path	addresses	control_effect	evidence	notes
calt_and_vector	0x00B8	CALT 00B8 enters 51EDh, which ANDs A with VV15 and writes F003h through 51F2h.	ROM bytes at 00B8 are 51 ED; traced call sites use CALT ($00B8), and 51EDh is the root-confirmed AND helper.	The recursive trace decodes 00B8 linearly as code, but this byte pair is a CALT vector entry for the CPU.
calt_or_vector	0x00BA	CALT 00BA enters 51E9h, which ORs A into VV15 and writes F003h through 51F2h.	ROM bytes at 00BA are 51 E9; traced call sites use CALT ($00BA), and 51E9h is the root-confirmed OR helper.	The recursive trace decodes 00BA linearly as code, but this byte pair is a CALT vector entry for the CPU.
startup_init_direct	0x0311-0x0315 / 0x0493-0x0497	Directly seeds VV15/F003h during startup and gate-array init.	0311h loads A=0Fh, stores VV15, and writes F003h; 0493h loads A=07h, stores VV15, and writes F003h.	These are direct writes, not CALT helper calls.
home_seek_leg_setup	0x51FB-0x5237	Startup home seek sets and clears F003 bits 0 and 1 before each carriage seek leg.	51FDh ORs 03h; 520Dh ANDs FCh; 521Fh ANDs FEh then 5222h ORs 02h; 5234h ORs 01h then 5237h ANDs FDh.	These masks match the manual F003 direction/excitation control-bit shape, but active polarity should stay tied to the manual/schematic.
state_byte_bit7_to_f003_bit0	0x5446-0x5457	In normal VV62=0 output dispatch, selected EFxx state-byte bit 7 controls F003 bit 0 before the low seven bits index the 7007h current-state jump table.	5446h tests A.7; if set, 5449h sets VV61.1 and 544Dh/544Fh clear F003 bit 0 with A=FEh via CALT 00B8. If clear, 5453h/5455h set F003 bit 0 with A=01h via CALT 00BA. 5457h then masks A with 7Fh before the jump-table index.	Manual Table 2-4 says F003 bit 0 selects 2-2 versus 1-2 excitation; this ties the record high bit to excitation selection, not current level.
vv61_direction_to_f003_bit1	0x5625-0x5630	After loading a timing record, VV61.0 controls F003 bit 1.	5625h tests VV61.0; when set, 5629h/562Bh clear F003 bit 1 with A=FDh via CALT 00B8. When clear, 562Dh/562Fh set F003 bit 1 with A=02h via CALT 00BA.	Manual Table 2-4 says F003 bit 1 selects CW/CCW. This path likely applies the direction bit after record setup.
