profile	record_address	vv63_select	excitation_family	manual_table_match	ef51_initial_word	accel_count_vv4c	accel_ptr_ef4f	decel_count_vv54	decel_ptr_ef57	timer_word_examples	selector_rows	evidence	notes
runtime_record_0	0x700F	0x00	2-2	Tables 2-12/2-13 x3 900 PPS	0x0540	0x0D	0x70BF	0x0D	0x70D9	0x13BE~4.11ms; 0x0D70~2.80ms; 0x0999~2.00ms; 0x0554~1.11ms	72B3 index 0	55B1 copies the 0x7005 record selected by VV63 into EF49..EF60. FE1 walks EF4F at 0772h for accel and EF57 at 0799h for decel; timer words are ECNT addends, not 10 us literals.	First accel word is slightly slower than the printed 4.00 ms manual value, matching the known pattern of ROM timing adjustment.
runtime_record_1	0x7027	0x01	2-2	Tables 2-12/2-13 x2 600 PPS	0x0800	0x0D	0x70F3	0x0D	0x710D	0x11A1~3.67ms; 0x0F74~3.22ms; 0x0A8F~2.20ms; 0x0800~1.67ms	72B3 indices 1 and 4	Same 0x0D/0x0D runtime profile shape as record 0; values match the x2 600 PPS 2-2 accel/decel column, with adjusted first interval.	Selected by two sequence records with different TM1 cycle bytes.
runtime_record_2	0x703F	0x02	1-2	Tables 2-14/2-15 x1.5 900 PPS	0x0540	0x1A	0x7127	0x1A	0x715B	0x1062~3.41ms; 0x0C7A~2.60ms; 0x0B16~2.31ms; 0x0999~2.00ms; 0x0554~1.11ms	72B3 index 2	The 0x1A/0x1A profile length and 1.11 ms constant-speed words match the 1-2 x1.5 manual timing profile. Raw state bytes carry bit 7, which 540Dh maps to F003 bit 0 before current-state dispatch.	This is the located ROM profile for Tables 2-14/2-15 x1.5.
runtime_record_3	0x7057	0x03	1-2	Tables 2-14/2-15 x1 600 PPS	0x0800	0x1A	0x718F	0x1A	0x71C3	0x1062~3.41ms; 0x0C7A~2.60ms; 0x0AA8~2.22ms; 0x0999~2.00ms; 0x07F7~1.66ms	72B3 indices 3, 5, and 6	The 0x1A/0x1A profile length and 1.66 ms constant-speed words match the 1-2 x1 manual timing profile. Raw state bytes carry bit 7 for the F003 bit 0 excitation side effect.	Used by multiple selector rows; row 5 combines this profile with slower TM1 cycle bytes.
runtime_record_4	0x706F	0x04	1-2 slow/intermediate	non-Table-2-7 slower profile	0x0C00	0x1A	0x71F7	0x1A	0x722B	0x1062~3.41ms; 0x0E7F~3.06ms; 0x0C7A~2.60ms; 0x0C00~2.50ms	72B3 index 7	Same 0x1A/0x1A runtime shape and bit-7 F003 excitation side effect as the 1-2 records, but the constant region is 0x0C00, about 2.50 ms.	Decoded as a real slower/intermediate movement profile rather than an unresolved x1/x1.5 row.
startup_5253_delay_table	0x7287	-	startup timed seek	manual timing overlap, separate 10 us table	-	-	0x7287	-	0x729B	0x0162=3.54ms; 0x0114=2.76ms; 0x00E7=2.31ms; 0x00C8=2.00ms; 0x00A6=1.66ms; 0x007A=1.22ms	startup 51F7h-5253h only in current trace	5253h loads 7287h/729Bh/72ADh directly, calls 5306h to sample PA5 during each delay, and pulses PC7 through 0908h.	This table is 10 us-scaled startup movement delay data; runtime carriage acceleration/deceleration profiles are the 7005h records above.
