index	address	vv7c_record_select	runtime_profile	vv7d_tm1_cycle_len	ef7e_ef80_tm1_sequence	tm1_family	table_2_7_mode	evidence	notes
0	0x72B3	0x00	runtime_record_0	0x02	15 15 00	900-ish TM1 cycle	x3_900_pps_2-2	5715h indexes this table with (VV6F & 07h) * 5; 56CE-56D3 copies five bytes to EF7C..EF80 because uPD7810 BLOCK repeats until C underflows. FE1 at 09AC loads TM1 from EF7E + VV81 and wraps VV81 when it reaches VV7D. VV7C=00h selects 7005h record 0, whose 0x0D/0x0D timing profile matches Tables 2-12/2-13 x3 900 PPS 2-2.	Third sequence byte is copied but not used while VV7D=02h.
1	0x72B8	0x01	runtime_record_1	0x03	15 15 16	900-ish TM1 cycle	x2_600_pps_2-2_profile	09AC-09BC cycles TM1 through three values: 15h, 15h, 16h. VV7C=01h selects 7005h record 1, whose 0x0D/0x0D timing profile matches Tables 2-12/2-13 x2 600 PPS 2-2.	Uses faster TM1 cycle bytes than index 4 while selecting the same runtime timing profile.
2	0x72BD	0x02	runtime_record_2	0x02	15 15 00	900-ish TM1 cycle	x1.5_900_pps_1-2	Same two-entry TM1 sequence as record 0, with VV7C=02h selecting 7005h record 2. Its 0x1A/0x1A timing profile at 7127h/715Bh matches Tables 2-14/2-15 x1.5 900 PPS 1-2; raw state bytes carry bit7, and 540Dh maps that bit to F003 bit0 before masking the state byte for current-state dispatch.	Located 1-2 timing profile; no longer an unresolved selector-only row.
3	0x72C2	0x03	runtime_record_3	0x03	15 15 16	900-ish TM1 cycle	x1_600_pps_1-2_profile	Same three-entry TM1 sequence as record 1, with VV7C=03h selecting 7005h record 3. Its 0x1A/0x1A timing profile at 718Fh/71C3h matches Tables 2-14/2-15 x1 600 PPS 1-2; raw state bytes carry bit7 for F003 bit0 excitation selection.	Uses faster TM1 cycle bytes while selecting the x1 600 PPS runtime timing profile.
4	0x72C7	0x01	runtime_record_1	0x02	20 20 00	600-ish TM1 cycle	x2_600_pps_2-2	09AC-09BC cycles TM1 through two 20h values. VV7C=01h selects 7005h record 1, whose runtime profile matches Tables 2-12/2-13 x2 600 PPS 2-2.	Third sequence byte is copied but not used while VV7D=02h.
5	0x72CC	0x03	runtime_record_3	0x03	2A 2A 2C	slower TM1 cycle	x1_600_pps_1-2_slow_tm1	09AC-09BC cycles TM1 through three values: 2Ah, 2Ah, 2Ch. VV7C=03h selects 7005h record 3, the Tables 2-14/2-15 x1 600 PPS 1-2 runtime profile; raw state bytes carry bit7 for the F003 bit0 excitation side effect.	Decoded as the x1 1-2 timing profile combined with slower TM1 cycle bytes.
6	0x72D1	0x03	runtime_record_3	0x02	20 20 00	600-ish TM1 cycle	x1_600_pps_1-2	563Ch ORs VV6F.2, so an incoming low bits 010b select this record in the normal scheduler; VV6F.1 halves EF64 into EF79. VV7C=03h selects 7005h record 3, the Tables 2-14/2-15 x1 600 PPS 1-2 runtime profile.	Located 1-2 timing profile; no longer an unresolved selector-only row.
7	0x72D6	0x04	runtime_record_4	0x03	20 20 20	600-ish TM1 cycle	slower_1-2_intermediate_profile	09AC-09BC cycles TM1 through three identical 20h values. VV7C=04h selects 7005h record 4, a 0x1A/0x1A bit7/F003 1-2-family profile with about 2.50 ms constant timing.	Decoded as a real slower/intermediate profile rather than an unresolved x1 row.
